{"atomic":true,"authorityBinding":{"acceptance":{"id":"curation-program-acceptance-map-v1","path":"registry/program-acceptance-map.json","sha256":"c9d0fb437fb3eae93ffd144a2e3ee418dca90d96e5a266b61d7c7ec3efa6079f"},"bindingRegistry":{"id":"harness-scenario-evidence-bindings-v1","path":"registry/harness-scenario-evidence-bindings-v1.json","sha256":"df51c73c2dcfd5e59982395f1bdf73748b5cb9bef4c2028098865f0de74bc659"},"coverage":{"id":"human-ai-collaboration-current-candidate-capability-coverage-reconciliation-2026-08-01","path":"registry/human-ai-collaboration-current-candidate-capability-coverage-reconciliation-2026-08-01.json","sha256":"d962097402f55c3bc878df0a6ce192ee35086eceef4ea97c4c8d258a971bdf65"},"scheduler":{"id":"portfolio-tasktime-projection-v1","path":"registry/portfolio-tasktime-projection-contract-2026-08-06.json","sha256":"dce3435883657a5a7731a37fcde52a67b610ed8510682a8c8b9c9733a6689531"},"semanticAuthority":{"id":"skill-portfolio-current-authority-v1","path":"registry/skill-portfolio-current-authority.json","sha256":"4a5142baad160ceebb646803d31fd7647c364c4eef9acd45163ecada36bb91ea"}},"authorizationGates":{"connectAccount":false,"dispatchModel":false,"enable":false,"executeCandidate":false,"install":false,"mutateCcSwitch":false,"mutateConsumer":false,"publish":false,"release":false},"claimBoundary":{"candidateCausationProved":false,"crossHostValueProved":false,"humanControlExecuted":false,"instructionDeliveryProved":false,"liveDomainValueProved":false,"residualSelfAuthoredGapProved":false},"entries":[{"bindingEvidenceCeiling":"source-record-identity-only-no-evidence-promotion","bindingMode":"scenario-record","decisionState":"mechanism-evidence-only","packetSha256":"24fe601025d395ead55d9498b538c7459e5070377b3dec318165d855e69601d2","scenarioId":"GEN-CREATIVE-01","selectedRoute":null,"sourcePath":"registry/human-ai-collaboration-creative-capability-baseline-2026-07-31.json","sourceSha256":"4da4ac66da0c4577e05cbfe0968c1a139612084bfa2e632a09be25b106a5eea6"},{"bindingEvidenceCeiling":"source-record-identity-only-no-evidence-promotion","bindingMode":"scenario-record","decisionState":"mechanism-evidence-only","packetSha256":"6102a9d2f126f33ee9d81315764b4c14b72433dc948209fa43a66bb89162ed0b","scenarioId":"GEN-RESEARCH-01","selectedRoute":null,"sourcePath":"registry/human-ai-collaboration-scenario-evidence-matrix-batch-01-2026-07-24.json","sourceSha256":"5e0a91a0bcc2d32f56aeebce2d7ece63fc9c8386fddaf423f864496cd4c29cb9"},{"bindingEvidenceCeiling":"source-record-identity-only-no-evidence-promotion","bindingMode":"scenario-record","decisionState":"mechanism-evidence-only","packetSha256":"35a7ed62545464e484ed47ec2151baed48eeefd11c00666d5f12907dab3619ea","scenarioId":"GEN-LEARNING-01","selectedRoute":null,"sourcePath":"registry/human-ai-collaboration-learning-capability-baseline-2026-07-31.json","sourceSha256":"d0bb1082647cb08be4ce91203b27e384d62ba1090b8724cc3c459ac90524c001"},{"bindingEvidenceCeiling":"source-record-identity-only-no-evidence-promotion","bindingMode":"scenario-record","decisionState":"mechanism-evidence-only","packetSha256":"1830b5a54d39ceba189bc1210231528cdb988287e58489f73ffcad76f789a390","scenarioId":"GEN-ORG-DECISION-01","selectedRoute":null,"sourcePath":"registry/human-ai-collaboration-org-decision-zero-model-protocol-2026-07-31.json","sourceSha256":"2d9c4d1e0313e0de53dc91ae1f453828d0e2b017780c1ae1483ea253cc9578a6"},{"bindingEvidenceCeiling":"source-record-identity-only-no-evidence-promotion","bindingMode":"scenario-record","decisionState":"mechanism-evidence-only","packetSha256":"bb8139e38cdc02dceadbd18920a643a2aa1f62bd5285581ac4b6721a95922498","scenarioId":"GEN-ACCESS-COMMS-01","selectedRoute":null,"sourcePath":"registry/human-ai-collaboration-access-comms-capability-baseline-2026-07-31.json","sourceSha256":"a141513ec71a8127fb37ee4803ccab4c3bdd7aca8be0e91755f87fa659ed4239"},{"bindingEvidenceCeiling":"source-record-identity-only-no-evidence-promotion","bindingMode":"scenario-record","decisionState":"mechanism-evidence-only","packetSha256":"3efd4fb26d6244c29412a6808950f64a5835459598e447c6fb02d382be467717","scenarioId":"SE-DISCOVERY-REQ-01","selectedRoute":null,"sourcePath":"registry/other-cc-and-external-skill-scenario-coverage-audit-2026-07-27.json","sourceSha256":"9c7912d1b859274675b98d5622b091caf2bc2779ca416806c6629be849940d69"},{"bindingEvidenceCeiling":"document-level-support-no-independent-scenario-identity","bindingMode":"document-level-support","decisionState":"mechanism-evidence-only","packetSha256":"3b933ddae8beb87a24adfc174a53bf13cab1a6c173b271df17fa2549497b4f50","scenarioId":"SE-ARCH-DESIGN-01","selectedRoute":null,"sourcePath":"registry/human-ai-collaboration-software-lifecycle-thin-slice-zero-model-calibration-evidence-2026-07-27.json","sourceSha256":"822c87738914f81ae621f9591ed330ea4f877b20b610949e1ee17fff6a5fd57a"},{"bindingEvidenceCeiling":"source-record-identity-only-no-evidence-promotion","bindingMode":"scenario-record","decisionState":"mechanism-evidence-only","packetSha256":"eb97e62bf987610602c8d417d207209727b93dd09a7ba0b1f89fc1c3a29136e9","scenarioId":"SE-IMPLEMENT-REVIEW-01","selectedRoute":null,"sourcePath":"registry/other-cc-and-external-skill-scenario-coverage-audit-2026-07-27.json","sourceSha256":"9c7912d1b859274675b98d5622b091caf2bc2779ca416806c6629be849940d69"},{"bindingEvidenceCeiling":"document-level-support-no-independent-scenario-identity","bindingMode":"document-level-support","decisionState":"mechanism-evidence-only","packetSha256":"87a43f2caf7fea4a4a7a8ac94eab9031c0e9acfefb538737c278dc8bc3f426e5","scenarioId":"SE-VERIFY-SECURE-01","selectedRoute":null,"sourcePath":"registry/human-ai-collaboration-software-lifecycle-thin-slice-zero-model-calibration-evidence-2026-07-27.json","sourceSha256":"822c87738914f81ae621f9591ed330ea4f877b20b610949e1ee17fff6a5fd57a"},{"bindingEvidenceCeiling":"source-record-identity-only-no-evidence-promotion","bindingMode":"scenario-record","decisionState":"mechanism-evidence-only","packetSha256":"9f350b3586d94fa97344b5be3549fdac1497c700f0298a5ec1fbdbdbbb4cef4e","scenarioId":"SE-RELEASE-CHANGE-01","selectedRoute":null,"sourcePath":"registry/human-ai-collaboration-release-change-current-cc-codex-no-model-preflight-2026-07-30.json","sourceSha256":"98bc807ba4a37f7159116a7da67741180c869b92084c1ca849d492aaa671e2eb"},{"bindingEvidenceCeiling":"source-record-identity-only-no-evidence-promotion","bindingMode":"scenario-record","decisionState":"mechanism-evidence-only","packetSha256":"596a75e26c5afe29e58f94d6e63e8763d45325e7151500376882db44e03f54b3","scenarioId":"SE-OPS-INCIDENT-01","selectedRoute":null,"sourcePath":"registry/other-cc-and-external-skill-scenario-coverage-audit-2026-07-27.json","sourceSha256":"9c7912d1b859274675b98d5622b091caf2bc2779ca416806c6629be849940d69"},{"bindingEvidenceCeiling":"source-record-identity-only-no-evidence-promotion","bindingMode":"scenario-record","decisionState":"mechanism-evidence-only","packetSha256":"829ec95869a99463e7187587a55369f629451c1c93f4364f2618d0c530d13824","scenarioId":"SE-MAINT-MIGRATE-01","selectedRoute":null,"sourcePath":"registry/other-cc-and-external-skill-scenario-coverage-audit-2026-07-27.json","sourceSha256":"9c7912d1b859274675b98d5622b091caf2bc2779ca416806c6629be849940d69"},{"bindingEvidenceCeiling":"source-record-identity-only-no-evidence-promotion","bindingMode":"scenario-record","decisionState":"mechanism-evidence-only","packetSha256":"dcc670f6b788b5135122f3269a3ea46ae77081d6ac9bc715ab8fa26bd7e41e06","scenarioId":"SE-MGMT-PRACTICE-01","selectedRoute":null,"sourcePath":"registry/human-ai-collaboration-engineering-management-zero-model-protocol-2026-07-31.json","sourceSha256":"e06657f09e89198650703fcca6c053a6134b312527ea6d8ca23fa2615ed90e16"}],"executionCounters":{"accountConnectionCount":0,"candidateExecutionCount":0,"consumerMutationCount":0,"enablementCount":0,"installationCount":0,"managerMutationCount":0,"modelRequestCount":0,"pluginExecutionCount":0,"publicationCount":0},"id":"harness-decision-packet-thirteen-scenario-manifest-v1","manifestSha256":"db931f2d11633dc99950b4604dfbaf89d42915afcd328004d101fd7728b7fa6d","packetSchema":2,"projectionBoundary":{"derivedProjectionNotAuthority":true,"legacyRoutingIsCurrentAuthority":false,"pluginReleaseEligible":false,"portableCoreDependsOnCcSwitch":false},"scenarioCount":13,"schema":1}
